{
  "schema_version": "0.1",
  "generated_at": "2026-05-23T00:00:00Z",
  "status": "no_external_validation_completed",
  "independent_reproductions": [],
  "public_critiques": [],
  "human_annotation_batches": [],
  "claim_boundary": "This ledger records external validation state. Empty arrays mean no independent reproduction, public critique, or human annotation batch has been completed yet.",
  "blockers": [
    "Live provider benchmark artifacts are not present.",
    "Independent reproduction has not been performed.",
    "Independent human annotation batches have not been collected.",
    "Public critique or Hugging Face discussion has not occurred."
  ]
}
